<?xml version="1.0" encoding="UTF-8"?>
<accounts xmlns:xsi="http://www.w3.org/2001/XMLSchema-instance"
 xsi:noNamespaceSchemaLocation="accounts.xsd">
    <account>
    	<accountNumber>1</accountNumber>
        <type>CurrentAccount</type>
        <label>Compte courant</label>
        <balance>0.0</balance>
        <client>
        	<clientNumber>1</clientNumber>
            <name>name0</name>
            <firstName>firstName0</firstName>
        </client>
    </account>
    <account>
    	<accountNumber>2</accountNumber>
        <type>SavingsAccount</type>
        <label>Epargne</label>
        <balance>0.0</balance>
        <client>
        <clientNumber>2</clientNumber>
            <name>name0</name>
            <firstName>firstName0</firstName>
        </client>
    </account>
</accounts>